{
  "schema_version": "1.0",
  "generated_at": "2026-08-11T06:16:55+00:00",
  "seed": "gym rivalry",
  "rubric_version": "1.0",
  "corpus_synthesis_version": "success-elements v2 + catalog C1-C6 v1",
  "roster_snapshot": [
    {
      "name": "Kelsey Brandt",
      "project": "cheer-ascension",
      "ref_status": "locked"
    },
    {
      "name": "Dana Lane",
      "project": "not-so-supra-man",
      "ref_status": "locked"
    },
    {
      "name": "Supraman",
      "project": "not-so-supra-man",
      "ref_status": "locked"
    },
    {
      "name": "Dee-Dee 'Destroya'",
      "project": "not-so-supra-man",
      "ref_status": "locked"
    },
    {
      "name": "Dex Doomer",
      "project": "not-so-supra-man",
      "ref_status": "locked"
    }
  ],
  "concepts": [
    {
      "concept_id": "home-court",
      "title": "Home Court",
      "logline": "On amnesty day Dee-Dee 'Destroya' walks into the heroes' own gym and challenges Dana Lane to a four-event lift-off — and the strength scoreboard starts paying each event's winner out of the loser.",
      "premise": "HQ's annual amnesty day lets anyone train at the heroes' gym, no arrests, no powers-drama. Dee-Dee arrives in workout gear with a printed rulebook: bench, deadlift, squat, overhead — four events on Dana's own equipment, tracked by the gym's strength-rating scoreboard. What nobody clocks until event one settles: Dex Doomer serviced the scoreboard last month, and now it TRANSFERS the rating gap — each event's winner physically banks the difference out of the loser's frame. Supraman referees, helpless under amnesty rules. Down two events, visibly outscaled on her home court, Dana stakes her remaining rating on the final lift, winner takes the room.",
      "transformation": {
        "flavor": "tech",
        "trigger": "Doomer-rigged strength scoreboard settling each event in bodymass",
        "arc": "amnesty-day challenge -> four-event ladder, mass swinging on each settle -> Dana outscaled on home equipment -> all-in final lift -> winner takes the room and the rating",
        "peak_state": "The winner posing on the platform under the maxed-out scoreboard, the loser at parity scale on the bench below",
        "tier_curve": "tier 3 -> 9 (winner) mirrored by 8 -> 3 (loser)"
      },
      "cast": [
        {
          "name": "Dee-Dee 'Destroya'",
          "role": "rival",
          "reuse": true,
          "ref_status": "locked"
        },
        {
          "name": "Dana Lane",
          "role": "protagonist",
          "reuse": true,
          "ref_status": "locked"
        },
        {
          "name": "Supraman",
          "role": "witness",
          "reuse": true,
          "ref_status": "locked"
        },
        {
          "name": "Dex Doomer",
          "role": "catalyst",
          "reuse": true,
          "ref_status": "locked"
        }
      ],
      "setting": "hq-gym (locked env pack)",
      "hook": "She brought a rulebook to the heroes' gym. The scoreboard is already on her side.",
      "est_page_count": 22,
      "chapter_type": "climax",
      "est_growth_page_ratio": 0.7,
      "planned_escalation_devices": [
        "size-comparison",
        "multi-panel-progressive",
        "reaction-intercut",
        "sfx-driven",
        "full-body-reveal"
      ],
      "generation_angle": "character-first",
      "why_itll_perform": "Full locked cast + the one locked env pack the unseeded slate never touched (hq-gym) = the cheapest 22 pages on either slate. The event structure is a countable ladder with a public scoreboard the pipeline bakes legibly (F2), and mass swinging on every settle keeps a climax-grade growth ratio (F1 >= 0.70) with the person-as-gauge staging (F4). Amnesty day gives the rivalry stakes without leaving the SFW lane.",
      "corpus_grounding": [
        "C1 serial-legs",
        "F1 climax >= 0.70",
        "F2 baked-dialogue-edge",
        "F4 size-comparison + reaction-intercut",
        "Gribble one-upmanship + power-transfer"
      ],
      "scores": {
        "growth_payoff_density": 5,
        "story_spine": 4,
        "hook": 4,
        "camera_staging_potential": 5,
        "cast_reuse": 5,
        "novelty": 2,
        "production_economy": 4
      },
      "score_rationale": "Climax-density event ladder with person-as-gauge on a fully locked cast/env — but it is the universe's SECOND strength-transfer book, so novelty pays for the economy.",
      "cast_size": 4,
      "weighted_total": 86.2
    },
    {
      "concept_id": "rep-thief",
      "title": "Rep Thief",
      "logline": "A curse routes every training adaptation Farrah earns to her gym rival Sloane's body — and when Farrah figures it out, her only counter-move is to stop being excellent.",
      "premise": "Farrah Okonkwo outworks everyone at Forge Fitness twice over; Sloane Byrd coasts, spots occasionally, and grows like a myth. The white-elephant wishbone Sloane snapped at the gym's holiday party did exactly what she asked: 'her results, my body.' Every rep Farrah grinds shows up on Sloane by morning. The mid-book reveal flips the rivalry into a genuinely unwinnable dilemma — Farrah CAN'T beat Sloane without feeding her, can't stall without losing everything she is, and the state championship she's trained her whole life for is in three weeks. She enters anyway, and the final day is Farrah lifting for the title while Sloane, ringside, outgrows the audience seating in real time.",
      "transformation": {
        "flavor": "curse",
        "trigger": "a wishbone wish — 'her results, my body' — snapped at the gym holiday party",
        "arc": "unexplained divergence -> Farrah's overtraining spiral feeds Sloane's rise -> the reveal and the stop-training standoff -> championship compulsion -> ringside real-time bloom as Farrah lifts for the title",
        "peak_state": "Sloane filling the ringside section as Farrah locks out the winning lift — two payoffs, one rep",
        "tier_curve": "tier 2 -> 8 (Sloane); Farrah stays tier 3, and the comic makes you feel it"
      },
      "cast": [
        {
          "name": "Farrah Okonkwo",
          "role": "protagonist",
          "reuse": false,
          "ref_status": "new"
        },
        {
          "name": "Sloane Byrd",
          "role": "rival",
          "reuse": false,
          "ref_status": "new"
        },
        {
          "name": "Coach Ines",
          "role": "witness",
          "reuse": false,
          "ref_status": "new"
        }
      ],
      "setting": "Forge Fitness + a championship platform (two interiors)",
      "hook": "Every rep she does shows up on her rival. She has a title to win anyway.",
      "est_page_count": 20,
      "chapter_type": "transformation",
      "est_growth_page_ratio": 0.6,
      "planned_escalation_devices": [
        "reaction-intercut",
        "multi-panel-progressive",
        "size-comparison",
        "clothing-destruction",
        "slow-burn"
      ],
      "generation_angle": "hook-first",
      "why_itll_perform": "The strongest story engine on the slate: the growth mechanic IS an unwinnable dilemma, so every training page is simultaneously a growth page and a stakes page (F1 and F5 rising together — the two top-weight axes). The reaction-intercut is structural — Farrah's effort and Sloane's bloom are the same beat seen twice (F4, F3 face-led on both ends). The champion-who-feeds-her-rival shape is the Gribble power-transfer twist told from the LOSER's side, which the corpus has never once done (F5 differentiation).",
      "corpus_grounding": [
        "F5 story-as-differentiator",
        "F1 growth-ratio-by-intent",
        "F4 reaction-intercut",
        "F3 face-led-ECUs",
        "Gribble power-transfer (loser-POV inversion)"
      ],
      "scores": {
        "growth_payoff_density": 5,
        "story_spine": 5,
        "hook": 5,
        "camera_staging_potential": 4,
        "cast_reuse": 0,
        "novelty": 5,
        "production_economy": 3
      },
      "score_rationale": "The unwinnable dilemma makes every training page a stakes page — F1 and F5 rising together; loser-POV power transfer is unprecedented in the corpus; two interiors and three new packs.",
      "cast_size": 3,
      "weighted_total": 86.2
    },
    {
      "concept_id": "mirror-set",
      "title": "Mirror Set",
      "logline": "After midnight the gym's mirror wall trues you up to whatever you flex in it — and two night-shift rivals start a posing war for the center panel.",
      "premise": "Closer-shift regulars Noor Haddad and Priscilla Cho discover Flexxen 24's secret: between midnight and close, the mirror wall reflects you a rep ahead — pose harder than your body and your body catches up to the reflection. Panel by panel down the wall, their posing war escalates from lat spreads to full routines, each woman flexing against the other's reflection. House rule, scratched into the glass corner: at closing, only the woman in the CENTER panel keeps what the mirrors gave. The last routine is fought in one shared reflection.",
      "transformation": {
        "flavor": "ambient-field",
        "trigger": "posing in the midnight mirror wall — the reflection leads, the body follows",
        "arc": "discovered flex -> panel-by-panel posing ladder -> routines against each other's reflections -> shared-center showdown -> closing-time lock-in",
        "peak_state": "The winner filling the center panel so completely the reflection crops to torso, the loser's reflection restored to baseline beside her",
        "tier_curve": "tier 2 -> 7"
      },
      "cast": [
        {
          "name": "Noor Haddad",
          "role": "protagonist",
          "reuse": false,
          "ref_status": "new"
        },
        {
          "name": "Priscilla Cho",
          "role": "rival",
          "reuse": false,
          "ref_status": "new"
        }
      ],
      "setting": "Flexxen 24 — one late-night gym interior; the mirror wall is the stage",